<?xml version="1.0" encoding="UTF-8"?>
<garden xmlns="http://www.w3schools.com"
        xmlns:xsi="http://www.w3.org/2001/XMLSchema-instance"
        xsi:schemaLocation="http://www.w3schools.com garden.xsd">
	<tree>
		<name>Arborvitae</name>
		<age>3.3</age>
		<height>2.59</height>
		<trunk>10.84</trunk>
	</tree>
	<tree>
		<name>Butternut</name>
		<age>3.8</age>
		<height>2.99</height>
		<trunk>6.84</trunk>
	</tree>
	<tree>
		<name>Hawthorns</name>
		<age>2.6</age>
		<height>2.29</height>
		<trunk>3.84</trunk>
	</tree>
	<tree>
		<name>Baobab</name>
		<age>4.1</age>
		<height>3.6900000000000004</height>
		<trunk>20.84</trunk>
	</tree>
	<shrub>
		<name>Abelia</name>
		<age>3.6</age>
		<height>1.62</height>
		<berries>true</berries>
		<flowers>blue</flowers>
	</shrub>
	<shrub>
		<name>Buddleja</name>
		<age>3.2</age>
		<height>1.42</height>
		<berries>true</berries>
		<flowers>pink</flowers>
	</shrub>
	<shrub>
		<name>Clianthus</name>
		<age>3.9000000000000004</age>
		<height>1.52</height>
		<berries>false</berries>
		<flowers>white</flowers>
	</shrub>
	<shrub>
		<name>Zanthoxylum</name>
		<age>2.8</age>
		<height>1.7200000000000002</height>
		<berries>false</berries>
		<flowers>yellow</flowers>
	</shrub>
	<shrub>
		<name>Zenobia pulverulenta</name>
		<age>2.9000000000000004</age>
		<height>1.32</height>
		<berries>true</berries>
		<flowers>aquamarine</flowers>
	</shrub>
</garden>